{
  "$schema": "https://json-schema.org/draft/2020-12/schema",
  "$id": "cartulary.network_flow_frontend_entrypoints.v6",
  "type": "object",
  "additionalProperties": false,
  "required": ["$schema", "schema_id", "profile_id", "contract_major", "network_flow"],
  "properties": {
    "$schema": { "const": "https://json-schema.org/draft/2020-12/schema" },
    "schema_id": { "const": "cartulary.network_flow_frontend_entrypoints.v6" },
    "profile_id": { "const": "network_flow_activity" },
    "contract_major": { "const": 6 },
    "network_flow": {
      "type": "object",
      "additionalProperties": false,
      "required": ["contract_index_path", "mapping_registry_path", "presentation_path", "schema_bundle_path"],
      "properties": {
        "contract_index_path": { "const": "contracts/network-flow/index.json" },
        "mapping_registry_path": { "const": "contracts/network-flow/mapping-registry.v2.json" },
        "presentation_path": { "const": "contracts/network-flow/presentation.v2.json" },
        "schema_bundle_path": { "const": "contracts/network-flow/schemas.v3.json" }
      }
    }
  }
}
